{
	"schema_version": 1,
	"cell": 65536,
	"revision": 2,
	"entities": [
		{
			"schema_version": 1,
			"entity_id": 1,
			"components": {
				"transform": {
					"x": 0,
					"y": 65536,
					"z": 0,
					"yaw_bam": 0
				}
			}
		},
		{
			"schema_version": 1,
			"entity_id": 2,
			"components": {
				"transform": {
					"x": 65536,
					"y": 0,
					"z": 0,
					"yaw_bam": 0
				},
				"portal": {
					"target_id": 99,
					"yaw_bam": 0,
					"cooldown_ticks": 0
				}
			}
		}
	]
}
