{
	"schema_version": 1,
	"cell": 65536,
	"revision": 12,
	"entities": [
		{
			"schema_version": 1,
			"entity_id": 1,
			"components": {
				"transform": {
					"x": 0,
					"y": 0,
					"z": 0,
					"yaw_bam": 0
				},
				"checkpoint": {
					"order": 0,
					"respawn_dx": 0,
					"respawn_dy": 0,
					"respawn_dz": 0
				}
			}
		},
		{
			"schema_version": 1,
			"entity_id": 2,
			"components": {
				"transform": {
					"x": 131072,
					"y": 0,
					"z": 0,
					"yaw_bam": 0
				},
				"checkpoint": {
					"order": 1,
					"respawn_dx": 0,
					"respawn_dy": 0,
					"respawn_dz": 0
				}
			}
		},
		{
			"schema_version": 1,
			"entity_id": 3,
			"components": {
				"transform": {
					"x": 65536,
					"y": 65536,
					"z": 131072,
					"yaw_bam": 0
				},
				"checkpoint": {
					"order": 2,
					"respawn_dx": 0,
					"respawn_dy": 0,
					"respawn_dz": 0
				}
			}
		},
		{
			"schema_version": 1,
			"entity_id": 20,
			"components": {
				"transform": {
					"x": 196608,
					"y": 0,
					"z": 0,
					"yaw_bam": 0
				},
				"portal": {
					"target_id": 21,
					"yaw_bam": 0,
					"cooldown_ticks": 0
				}
			}
		},
		{
			"schema_version": 1,
			"entity_id": 21,
			"components": {
				"transform": {
					"x": 0,
					"y": 65536,
					"z": 131072,
					"yaw_bam": 0
				},
				"portal": {
					"target_id": 20,
					"yaw_bam": 0,
					"cooldown_ticks": 0
				}
			}
		},
		{
			"schema_version": 1,
			"entity_id": 30,
			"components": {
				"transform": {
					"x": 131072,
					"y": 65536,
					"z": 131072,
					"yaw_bam": 0
				},
				"zone": {
					"shape": {
						"kind": "box",
						"hx": 32768,
						"hy": 32768,
						"hz": 32768
					},
					"tags": [
						"finish"
					]
				}
			}
		},
		{
			"schema_version": 1,
			"entity_id": 40,
			"components": {
				"transform": {
					"x": 0,
					"y": 0,
					"z": 65536,
					"yaw_bam": 0
				},
				"destructible": {
					"durability": 1,
					"regen_policy_id": 0
				}
			}
		},
		{
			"schema_version": 1,
			"entity_id": 60,
			"components": {
				"transform": {
					"x": 0,
					"y": 0,
					"z": -131072,
					"yaw_bam": 0
				},
				"hazard": {
					"damage": 0,
					"knockback": 0,
					"cooldown_ticks": 1
				}
			}
		},
		{
			"schema_version": 1,
			"entity_id": 70,
			"components": {
				"transform": {
					"x": -65536,
					"y": 0,
					"z": 0,
					"yaw_bam": 0
				},
				"zone": {
					"shape": {
						"kind": "box",
						"hx": 32768,
						"hy": 32768,
						"hz": 32768
					},
					"tags": [
						"solid"
					]
				}
			}
		},
		{
			"schema_version": 1,
			"entity_id": 80,
			"components": {
				"transform": {
					"x": 0,
					"y": -65536,
					"z": 0,
					"yaw_bam": 0
				},
				"zone": {
					"shape": {
						"kind": "box",
						"hx": 32768,
						"hy": 32768,
						"hz": 32768
					},
					"tags": [
						"solid"
					]
				}
			}
		},
		{
			"schema_version": 1,
			"entity_id": 81,
			"components": {
				"transform": {
					"x": 65536,
					"y": -65536,
					"z": 0,
					"yaw_bam": 0
				},
				"zone": {
					"shape": {
						"kind": "box",
						"hx": 32768,
						"hy": 32768,
						"hz": 32768
					},
					"tags": [
						"solid"
					]
				}
			}
		},
		{
			"schema_version": 1,
			"entity_id": 82,
			"components": {
				"transform": {
					"x": 131072,
					"y": -65536,
					"z": 0,
					"yaw_bam": 0
				},
				"zone": {
					"shape": {
						"kind": "box",
						"hx": 32768,
						"hy": 32768,
						"hz": 32768
					},
					"tags": [
						"solid"
					]
				}
			}
		},
		{
			"schema_version": 1,
			"entity_id": 83,
			"components": {
				"transform": {
					"x": 196608,
					"y": -65536,
					"z": 0,
					"yaw_bam": 0
				},
				"zone": {
					"shape": {
						"kind": "box",
						"hx": 32768,
						"hy": 32768,
						"hz": 32768
					},
					"tags": [
						"solid"
					]
				}
			}
		},
		{
			"schema_version": 1,
			"entity_id": 84,
			"components": {
				"transform": {
					"x": 0,
					"y": 0,
					"z": 131072,
					"yaw_bam": 0
				},
				"zone": {
					"shape": {
						"kind": "box",
						"hx": 32768,
						"hy": 32768,
						"hz": 32768
					},
					"tags": [
						"solid"
					]
				}
			}
		},
		{
			"schema_version": 1,
			"entity_id": 85,
			"components": {
				"transform": {
					"x": 65536,
					"y": 0,
					"z": 131072,
					"yaw_bam": 0
				},
				"zone": {
					"shape": {
						"kind": "box",
						"hx": 32768,
						"hy": 32768,
						"hz": 32768
					},
					"tags": [
						"solid"
					]
				}
			}
		},
		{
			"schema_version": 1,
			"entity_id": 86,
			"components": {
				"transform": {
					"x": 131072,
					"y": 0,
					"z": 131072,
					"yaw_bam": 0
				},
				"zone": {
					"shape": {
						"kind": "box",
						"hx": 32768,
						"hy": 32768,
						"hz": 32768
					},
					"tags": [
						"solid"
					]
				}
			}
		},
		{
			"schema_version": 1,
			"entity_id": 100,
			"components": {
				"transform": {
					"x": 0,
					"y": 0,
					"z": 0,
					"yaw_bam": 0
				},
				"inventory": {
					"item_state": "bomb"
				}
			}
		},
		{
			"schema_version": 1,
			"entity_id": 101,
			"components": {
				"transform": {
					"x": 0,
					"y": 0,
					"z": 0,
					"yaw_bam": 0
				},
				"inventory": {
					"item_state": "dash"
				}
			}
		},
		{
			"schema_version": 1,
			"entity_id": 200,
			"components": {
				"transform": {
					"x": 65536,
					"y": -65536,
					"z": -65536,
					"yaw_bam": 0
				},
				"zone": {
					"shape": {
						"kind": "box",
						"hx": 32768,
						"hy": 32768,
						"hz": 32768
					},
					"tags": [
						"solid"
					]
				}
			}
		},
		{
			"schema_version": 1,
			"entity_id": 201,
			"components": {
				"transform": {
					"x": 65536,
					"y": 0,
					"z": -65536,
					"yaw_bam": 0
				},
				"hazard": {
					"damage": 0,
					"knockback": 0,
					"cooldown_ticks": 30
				},
				"zone": {
					"shape": {
						"kind": "box",
						"hx": 32768,
						"hy": 32768,
						"hz": 32768
					},
					"tags": [
						"flame"
					]
				}
			}
		},
		{
			"schema_version": 1,
			"entity_id": 202,
			"components": {
				"transform": {
					"x": 196608,
					"y": -65536,
					"z": -65536,
					"yaw_bam": 0
				},
				"zone": {
					"shape": {
						"kind": "box",
						"hx": 32768,
						"hy": 32768,
						"hz": 32768
					},
					"tags": [
						"solid"
					]
				}
			}
		},
		{
			"schema_version": 1,
			"entity_id": 203,
			"components": {
				"transform": {
					"x": 196608,
					"y": 0,
					"z": -65536,
					"yaw_bam": 0
				},
				"hazard": {
					"damage": 0,
					"knockback": 0,
					"cooldown_ticks": 30
				},
				"zone": {
					"shape": {
						"kind": "box",
						"hx": 32768,
						"hy": 32768,
						"hz": 32768
					},
					"tags": [
						"roller"
					]
				}
			}
		},
		{
			"schema_version": 1,
			"entity_id": 204,
			"components": {
				"transform": {
					"x": 0,
					"y": -65536,
					"z": -65536,
					"yaw_bam": 0
				},
				"zone": {
					"shape": {
						"kind": "box",
						"hx": 32768,
						"hy": 32768,
						"hz": 32768
					},
					"tags": [
						"solid",
						"spike"
					]
				}
			}
		}
	]
}
